{
  "question_id": "lost-gravity-country",
  "condition": "complete",
  "gold_support_ids": ["lost-gravity::0", "mack-rides::0"],
  "evidence": [
    {"evidence_id": "lost-gravity::0", "document_id": "lost-gravity", "title": "Lost Gravity", "text": "Lost Gravity was manufactured by Mack Rides."},
    {"evidence_id": "mack-rides::0", "document_id": "mack-rides", "title": "Mack Rides", "text": "Mack Rides is headquartered in Germany."}
  ]
}
